{
  "schema_version": 1,
  "record_kind": "towel_observation_annotation",
  "observation_id": "bootstrap-20260826_top_01-first_fold_0014",
  "split": "train",
  "state_label": "AMBIGUOUS",
  "image_width_px": 1280,
  "image_height_px": 960,
  "segmentation_polygon_px": [
    [
      156.0,
      248.0
    ],
    [
      78.0,
      532.0
    ],
    [
      84.0,
      560.0
    ],
    [
      450.0,
      609.0
    ],
    [
      786.0,
      637.0
    ],
    [
      953.0,
      636.0
    ],
    [
      960.0,
      341.0
    ],
    [
      953.0,
      296.0
    ],
    [
      940.0,
      284.0
    ],
    [
      294.0,
      231.0
    ],
    [
      173.0,
      231.0
    ]
  ],
  "corners": [],
  "fold_lines_px": [],
  "height_available": false,
  "occluded": false,
  "ambiguous_reason": "human_reviewed_segmentation_only",
  "source": {
    "image_path": "05_first_fold/first_fold_0014.jpg",
    "sha256": "a4cc63d1825ad77afbb2e11dc720964e45e26334483a68e773a9ed67be2df169",
    "capture_id": null
  }
}
