{
  "schema_version": 1,
  "record_kind": "towel_observation_annotation",
  "observation_id": "bootstrap-20260826_top_01-light_wrinkle_0048",
  "split": "train",
  "state_label": "AMBIGUOUS",
  "image_width_px": 1280,
  "image_height_px": 960,
  "segmentation_polygon_px": [
    [
      435.94272076372306,
      81.14558472553699
    ],
    [
      447.87589498806676,
      276.8496420047733
    ],
    [
      416.8496420047732,
      556.0859188544152
    ],
    [
      397.7565632458233,
      699.2840095465394
    ],
    [
      400.14319809069207,
      737.4701670644391
    ],
    [
      574.3675417661098,
      756.563245823389
    ],
    [
      662.6730310262529,
      758.9498806682578
    ],
    [
      729.4988066825775,
      756.563245823389
    ],
    [
      755.7517899761336,
      844.8687350835322
    ],
    [
      855.9904534606205,
      849.6420047732697
    ],
    [
      977.708830548926,
      854.4152744630072
    ],
    [
      1015.8949880668258,
      837.708830548926
    ],
    [
      937.1360381861575,
      653.9379474940334
    ],
    [
      848.8305489260143,
      491.64677804295945
    ],
    [
      829.7374701670644,
      396.18138424821007
    ],
    [
      841.6706443914081,
      298.3293556085919
    ],
    [
      848.8305489260143,
      186.15751789976133
    ],
    [
      717.5656324582338,
      164.67780429594274
    ],
    [
      681.7661097852028,
      167.06443914081146
    ],
    [
      667.4463007159904,
      174.22434367541766
    ],
    [
      657.8997613365156,
      73.9856801909308
    ],
    [
      650.7398568019092,
      59.66587112171838
    ],
    [
      586.3007159904535,
      40.572792362768496
    ],
    [
      524.2482100238664,
      31.026252983293556
    ],
    [
      462.19570405727916,
      64.43914081145584
    ]
  ],
  "corners": [],
  "fold_lines_px": [],
  "height_available": false,
  "occluded": false,
  "ambiguous_reason": "human_reviewed_segmentation_only",
  "source": {
    "image_path": "02_light_wrinkle/light_wrinkle_0048.jpg",
    "sha256": "dcdd3bc88e397867d0bd53186b5dba11e83cb4c58be163d6e330365d00e1202b",
    "capture_id": null
  }
}
