{
  "schema_version": 1,
  "record_kind": "towel_observation_annotation",
  "observation_id": "bootstrap-20260826_top_01-curled_or_overlapped_0044",
  "split": "train",
  "state_label": "AMBIGUOUS",
  "image_width_px": 1280,
  "image_height_px": 960,
  "segmentation_polygon_px": [
    [
      155.0,
      843.0
    ],
    [
      323.0,
      889.0
    ],
    [
      415.0,
      902.0
    ],
    [
      524.0,
      902.0
    ],
    [
      641.0,
      857.0
    ],
    [
      936.0,
      621.0
    ],
    [
      1058.0,
      490.0
    ],
    [
      1081.0,
      451.0
    ],
    [
      1052.0,
      239.0
    ],
    [
      489.0,
      171.0
    ],
    [
      311.0,
      171.0
    ],
    [
      180.0,
      652.0
    ]
  ],
  "corners": [],
  "fold_lines_px": [],
  "height_available": false,
  "occluded": false,
  "ambiguous_reason": "human_reviewed_segmentation_only",
  "source": {
    "image_path": "04_curled_or_overlapped/curled_or_overlapped_0044.jpg",
    "sha256": "22a0da9ec22d1b4044badc741f78ed82e1d1b7c9c400a2d2187007bbe23f585f",
    "capture_id": null
  }
}
