{
  "schema_version": 1,
  "record_kind": "towel_observation_annotation",
  "observation_id": "bootstrap-20260826_top_01-second_fold_0048",
  "split": "train",
  "state_label": "AMBIGUOUS",
  "image_width_px": 1280,
  "image_height_px": 960,
  "segmentation_polygon_px": [
    [
      712.0,
      206.0
    ],
    [
      699.0,
      269.0
    ],
    [
      699.0,
      547.0
    ],
    [
      704.0,
      555.0
    ],
    [
      760.5250596658711,
      565.6324582338902
    ],
    [
      770.0,
      593.0
    ],
    [
      814.0,
      598.0
    ],
    [
      1072.0,
      589.0
    ],
    [
      1116.0,
      580.0
    ],
    [
      1148.0,
      562.0
    ],
    [
      1157.0,
      512.0
    ],
    [
      1152.0,
      450.0
    ],
    [
      1123.0,
      300.0
    ],
    [
      1097.0,
      219.0
    ],
    [
      980.0,
      206.0
    ],
    [
      720.0,
      201.0
    ]
  ],
  "corners": [],
  "fold_lines_px": [],
  "height_available": false,
  "occluded": false,
  "ambiguous_reason": "human_reviewed_segmentation_only",
  "source": {
    "image_path": "06_second_fold/second_fold_0048.jpg",
    "sha256": "ea8ddb83cb24be2a350ac1884e8f598ef89e5c01063f7801c69f91e7ac696ce9",
    "capture_id": null
  }
}
