{
  "schema_version": 1,
  "record_kind": "towel_observation_annotation",
  "observation_id": "bootstrap-20260827_top_validation_01-light_wrinkle_0003",
  "split": "validation",
  "state_label": "AMBIGUOUS",
  "image_width_px": 1280,
  "image_height_px": 960,
  "segmentation_polygon_px": [
    [
      198.9285714285715,
      105.59523809523809
    ],
    [
      194.16666666666669,
      118.69047619047618
    ],
    [
      192.0,
      136.0
    ],
    [
      194.0,
      293.0
    ],
    [
      242.0,
      719.0
    ],
    [
      523.0,
      679.0
    ],
    [
      571.0,
      655.0
    ],
    [
      656.0,
      585.0
    ],
    [
      691.0,
      585.0
    ],
    [
      728.0,
      625.0
    ],
    [
      771.0,
      631.0
    ],
    [
      981.0,
      557.0
    ],
    [
      965.0,
      502.0
    ],
    [
      891.0,
      407.0
    ],
    [
      873.0,
      324.0
    ],
    [
      849.0,
      279.0
    ],
    [
      821.0,
      50.0
    ],
    [
      607.2619047619048,
      47.26190476190475
    ],
    [
      503.6904761904762,
      0.0
    ],
    [
      437.0238095238096,
      54.4047619047619
    ]
  ],
  "corners": [],
  "fold_lines_px": [],
  "height_available": false,
  "occluded": false,
  "ambiguous_reason": "human_reviewed_segmentation_only",
  "source": {
    "image_path": "02_light_wrinkle/light_wrinkle_0003.jpg",
    "sha256": "eec0e3619e629c205054666957e58609a6ed9aa6d1cddfd556b53ae1d950f38f",
    "capture_id": "20260827_top_validation_01-light_wrinkle-0003"
  }
}
